{
  "schema_version": "1.0",
  "brand_id": "calapres",
  "conversation_fingerprint": "dddddddddddddddddddddddddddddddddddddddddddddddddddddddddddddddd",
  "message_fingerprint": "eeeeeeeeeeeeeeeeeeeeeeeeeeeeeeeeeeeeeeeeeeeeeeeeeeeeeeeeeeeeeeee",
  "generation": 1,
  "status": "waiting",
  "last_inbound_at": "2026-08-11T12:04:00+03:00",
  "not_before": "2026-08-11T12:04:30+03:00",
  "cancel_reason": null,
  "updated_at": "2026-08-11T12:04:00+03:00"
}
